{
  "$schema": "./schema/destinations.schema.json",
  "regions": {
    "bac": "Miền Bắc",
    "trung": "Miền Trung",
    "nam": "Miền Nam"
  },
  "categories": {
    "bien": "Biển đảo",
    "nui": "Núi rừng",
    "di-san": "Di sản",
    "thanh-pho": "Thành phố",
    "hang-dong": "Hang động"
  },
  "beachTypes": {
    "dao": "Đảo – đi tàu, máy bay",
    "du-thuyen": "Vịnh & du thuyền",
    "gan-thanh-pho": "Biển trong thành phố",
    "gia-dinh": "Biển êm, hợp gia đình",
    "lan-bien": "Lặn ngắm san hô",
    "the-thao": "Lướt ván, thể thao biển",
    "hoang-so": "Hoang sơ, ít khách"
  },
  "destinations": [
    {
      "id": "vinh-ha-long",
      "name": "Vịnh Hạ Long",
      "province": "Quảng Ninh",
      "region": "bac",
      "categories": [
        "bien",
        "di-san"
      ],
      "beach": [
        "du-thuyen",
        "gia-dinh"
      ],
      "rating": 4.9,
      "lat": 20.9101,
      "lng": 107.1839,
      "bestMonths": [
        4,
        5,
        6,
        7,
        8,
        9,
        10
      ],
      "tagline": "Kỳ quan thiên nhiên thế giới giữa lòng vịnh Bắc Bộ",
      "description": "Gần 2.000 hòn đảo đá vôi nhô lên giữa làn nước xanh ngọc tạo nên một bức tranh thủy mặc sống động. Hai lần được UNESCO công nhận là Di sản Thiên nhiên Thế giới, Hạ Long là nơi bạn có thể ngủ đêm trên du thuyền, chèo kayak qua những hang động bí ẩn và ngắm hoàng hôn buông xuống trên mặt vịnh.",
      "highlights": [
        "Hang Sửng Sốt",
        "Đảo Ti Tốp",
        "Làng chài Cửa Vạn",
        "Vịnh Lan Hạ"
      ],
      "bestTime": "Tháng 4 – 10",
      "duration": "2 – 3 ngày",
      "hero": "Halong Bay in Vietnam.jpg",
      "gallery": [
        {
          "file": "Ha Long Bay, Vietnam, Islands.jpg",
          "caption": "Những đảo đá vôi hùng vĩ"
        },
        {
          "file": "Ha Long Bay, sunset.jpg",
          "caption": "Hoàng hôn trên vịnh"
        },
        {
          "file": "Ha Long Bay - North East Vietnam.JPG",
          "caption": "Du thuyền len lỏi giữa các đảo"
        },
        {
          "file": "Hạ Long Bay.jpg",
          "caption": "Mặt vịnh xanh ngọc"
        },
        {
          "file": "Ha Long Bay - Bahía de Ha Long.JPG",
          "caption": "Thuyền buồm truyền thống"
        }
      ],
      "foods": [
        {
          "name": "Chả mực Hạ Long",
          "desc": "Mực giã tay dai giòn, chiên vàng thơm lừng – đặc sản số một đất mỏ.",
          "price": "350.000đ/kg",
          "file": "Chả mực Hạ Long, Quảng Ninh, Việt Nam.jpg"
        },
        {
          "name": "Bánh cuốn chả mực",
          "desc": "Bánh cuốn mỏng mềm ăn cùng chả mực giòn thơm – bữa sáng kiểu Quảng Ninh.",
          "price": "45.000đ",
          "file": "Banh cuon.jpg",
          "illustrative": "Bánh cuốn"
        },
        {
          "name": "Phở",
          "desc": "Món ăn quốc hồn quốc túy, bát phở nóng hổi cho buổi sáng trên vịnh.",
          "price": "45.000đ",
          "file": "Phở bò (39425047901).jpg"
        }
      ],
      "activities": [
        {
          "icon": "ri-ship-2-line",
          "title": "Ngủ đêm trên du thuyền",
          "desc": "Trải nghiệm 2 ngày 1 đêm, ngắm bình minh giữa vịnh."
        },
        {
          "icon": "ri-sailboat-line",
          "title": "Chèo kayak",
          "desc": "Luồn qua hang Luồn, khám phá các áng nước kín đáo."
        },
        {
          "icon": "ri-landscape-line",
          "title": "Leo đỉnh Ti Tốp",
          "desc": "Ngắm toàn cảnh vịnh từ trên cao sau hơn 400 bậc đá."
        },
        {
          "icon": "ri-flight-takeoff-line",
          "title": "Thủy phi cơ",
          "desc": "Ngắm vịnh từ bầu trời trong chuyến bay 25 phút."
        }
      ],
      "tips": [
        "Đặt du thuyền trước ít nhất 1 tuần vào mùa cao điểm.",
        "Mang theo kem chống nắng và giày đế bám để leo núi."
      ]
    },
    {
      "id": "sa-pa",
      "name": "Sa Pa",
      "province": "Lào Cai",
      "region": "bac",
      "categories": [
        "nui"
      ],
      "rating": 4.8,
      "lat": 22.3364,
      "lng": 103.8438,
      "bestMonths": [
        9,
        10,
        11
      ],
      "tagline": "Thị trấn trong sương và những thửa ruộng bậc thang",
      "description": "Nằm ở độ cao 1.600m, Sa Pa quyến rũ bởi khí hậu mát mẻ quanh năm, ruộng bậc thang uốn lượn như những nấc thang lên trời và bản sắc văn hóa đặc sắc của người H'Mông, Dao đỏ. Đây cũng là cửa ngõ chinh phục Fansipan – \"nóc nhà Đông Dương\".",
      "highlights": [
        "Đỉnh Fansipan",
        "Bản Cát Cát",
        "Thung lũng Mường Hoa",
        "Đèo Ô Quy Hồ"
      ],
      "bestTime": "Tháng 9 – 11 (mùa lúa chín)",
      "duration": "2 – 3 ngày",
      "hero": "Rice terraces in Sa Pa 02.jpg",
      "gallery": [
        {
          "file": "Rice terraces in Sa Pa 03.jpg",
          "caption": "Ruộng bậc thang Mường Hoa"
        },
        {
          "file": "Terraced fields Sa Pa Vietnam.JPG",
          "caption": "Những nấc thang lên trời"
        },
        {
          "file": "Fansipan-vietnam.jpg",
          "caption": "Fansipan – nóc nhà Đông Dương"
        },
        {
          "file": "Stairs to the Fansipan.jpg",
          "caption": "Bậc đá lên đỉnh Fansipan"
        }
      ],
      "foods": [
        {
          "name": "Thắng cố",
          "desc": "Món ăn truyền thống của người H'Mông, nấu từ thịt và nội tạng ngựa cùng thảo quả.",
          "price": "100.000đ",
          "file": "Thang Co (Cattle Intestines Soup).jpg"
        },
        {
          "name": "Cơm lam",
          "desc": "Gạo nếp nương nướng trong ống tre, dẻo thơm mùi khói bếp.",
          "price": "20.000đ/ống",
          "file": "Khao lam87.jpg"
        },
        {
          "name": "Lẩu cá hồi",
          "desc": "Cá hồi nuôi bằng nước suối lạnh Sa Pa, thịt chắc ngọt.",
          "price": "300.000đ",
          "file": "Homemade Hotpot.jpg",
          "illustrative": "Nồi lẩu nóng"
        }
      ],
      "activities": [
        {
          "icon": "ri-riding-line",
          "title": "Cáp treo Fansipan",
          "desc": "Chinh phục đỉnh 3.143m chỉ trong 15 phút."
        },
        {
          "icon": "ri-walk-line",
          "title": "Trekking bản làng",
          "desc": "Đi bộ qua Lao Chải, Tả Van, ngủ homestay người Dao."
        },
        {
          "icon": "ri-store-2-line",
          "title": "Chợ phiên vùng cao",
          "desc": "Chợ tình Sa Pa, chợ Bắc Hà rực rỡ sắc màu."
        },
        {
          "icon": "ri-camera-lens-line",
          "title": "Săn mây",
          "desc": "Ngắm biển mây trên đèo Ô Quy Hồ lúc bình minh."
        }
      ],
      "tips": [
        "Nhiệt độ về đêm có thể xuống dưới 10°C, nhớ mang áo ấm.",
        "Thuê người bản địa dẫn đường khi trekking."
      ]
    },
    {
      "id": "ha-noi",
      "name": "Hà Nội",
      "province": "Thủ đô",
      "region": "bac",
      "categories": [
        "thanh-pho",
        "di-san"
      ],
      "rating": 4.7,
      "lat": 21.0285,
      "lng": 105.8542,
      "bestMonths": [
        9,
        10,
        11
      ],
      "tagline": "Nghìn năm văn hiến bên hồ Gươm",
      "description": "Thủ đô ngàn năm tuổi là nơi giao thoa giữa nét cổ kính của 36 phố phường, những công trình kiến trúc Pháp và nhịp sống hiện đại. Dạo quanh hồ Hoàn Kiếm, thưởng thức một ly cà phê trứng hay bát phở gia truyền là cách tuyệt vời để cảm nhận hồn cốt Hà Nội.",
      "highlights": [
        "Hồ Hoàn Kiếm",
        "Văn Miếu – Quốc Tử Giám",
        "Phố cổ",
        "Lăng Chủ tịch Hồ Chí Minh"
      ],
      "bestTime": "Tháng 9 – 11 (mùa thu)",
      "duration": "2 – 3 ngày",
      "hero": "Turtle Tower, Hoan Kiem Lake, Hanoi 4G4A7301.jpg",
      "gallery": [
        {
          "file": "Hoan Kiem lake Hanoi (39513889222).jpg",
          "caption": "Hồ Hoàn Kiếm"
        },
        {
          "file": "Temple of Literature, Hanoi by Xiquinho Silva 04.jpg",
          "caption": "Văn Miếu – Quốc Tử Giám"
        },
        {
          "file": "Well of Heavenly Clarity - Temple of Literature, Hanoi - DSC04565.JPG",
          "caption": "Giếng Thiên Quang"
        },
        {
          "file": "Stelae of Doctors - Temple of Literature, Hanoi - DSC04563.JPG",
          "caption": "Bia Tiến sĩ"
        },
        {
          "file": "Hoan Kiem Lake, Hanoi, Vietnam (8120855653).jpg",
          "caption": "Hồ Gươm buổi sớm"
        }
      ],
      "foods": [
        {
          "name": "Phở Hà Nội",
          "desc": "Nước dùng trong, ngọt từ xương bò hầm hàng giờ, bánh phở mềm.",
          "price": "50.000đ",
          "file": "Phở bò, Cầu Giấy, Hà Nội.jpg"
        },
        {
          "name": "Bún chả",
          "desc": "Chả nướng than hoa thơm lừng, chấm nước mắm chua ngọt.",
          "price": "45.000đ",
          "file": "Bun-cha-hanoi.jpg"
        },
        {
          "name": "Chả cá Lã Vọng",
          "desc": "Cá lăng ướp nghệ, rán trên chảo mỡ cùng thì là và hành.",
          "price": "150.000đ",
          "file": "Chả cá Lã Vọng.jpg"
        },
        {
          "name": "Cà phê trứng",
          "desc": "Lớp kem trứng béo ngậy phủ trên cà phê đậm đà – phát minh của Hà Nội.",
          "price": "35.000đ",
          "file": "Cà phê trứng.jpg"
        }
      ],
      "activities": [
        {
          "icon": "ri-walk-line",
          "title": "Dạo phố đi bộ",
          "desc": "Phố đi bộ Hồ Gươm sôi động mỗi tối cuối tuần."
        },
        {
          "icon": "ri-bike-line",
          "title": "Xích lô phố cổ",
          "desc": "Ngắm 36 phố phường từ chiếc xích lô chầm chậm."
        },
        {
          "icon": "ri-emotion-laugh-line",
          "title": "Múa rối nước",
          "desc": "Nghệ thuật dân gian độc đáo tại Nhà hát Thăng Long."
        },
        {
          "icon": "ri-restaurant-line",
          "title": "Food tour đêm",
          "desc": "Khám phá ẩm thực đường phố Tạ Hiện, Đồng Xuân."
        }
      ],
      "tips": [